package,authors,description,url,msc,verified
Combinatorial Grassmannians,"Owsiejczuk, Andrzej",,http://mizar.org/version/current/html/combgras.html,,False
The Jordan-Hölder Theorem,"Riccardi, Marco",,http://mizar.org/version/current/html/group_9.html,20B30,True
Regular Expression Quantifiers – m to n Occurrences,"Trybulec, Michał",,http://mizar.org/version/current/html/flang_2.html,,False
Riemann Indefinite Integral of Functions  of Real Variable,"Shidama, Yasunari and Endou, Noboru and Wasaki, Katsumi",,http://mizar.org/version/current/html/integra7.html,26A42,True
Partial Differentiation on Normed Linear Spaces ^n,"Endou, Noboru and Shidama, Yasunari and Miyajima, Keiichi",,http://mizar.org/version/current/html/pdiff_1.html,46E15,True
Several Differentiation Formulas of Special Functions. Part V,"Wang, Peng and Li, Bo",,http://mizar.org/version/current/html/fdiff_9.html,,False
The Product Space of Real Normed Spaces and its Properties,"Endou, Noboru and Shidama, Yasunari and Miyajima, Keiichi",,http://mizar.org/version/current/html/prvect_2.html,,False
Mizar Analysis of Algorithms: Preliminaries,"Bancerek, Grzegorz",,http://mizar.org/version/current/html/aofa_000.html,,False
Definition and some Properties of Information Entropy,"Zhang, Bo and Nakamura, Yatsuka",,http://mizar.org/version/current/html/entropy1.html,68P30,True
String Rewriting Systems,"Trybulec, Michał",,http://mizar.org/version/current/html/rewrite2.html,68Q42,True
Determinant and Inverse of Matrices  of Real Elements,"Tamura, Nobuyuki and Nakamura, Yatsuka",,http://mizar.org/version/current/html/matrixr2.html,15A09,True
The Rank+Nullity Theorem,"Alama, Jesse",,http://mizar.org/version/current/html/ranknull.html,,False
Laplace Expansion,"Pąk, Karol and Trybulec, Andrzej",,http://mizar.org/version/current/html/laplace.html,,False
Some Properties of Line and Column Operations on Matrices,"Liang, Xiquan and Sun, Tao and Hu, Dahai",,http://mizar.org/version/current/html/matrix12.html,15A09,True
The Sylow Theorems,"Riccardi, Marco",,http://mizar.org/version/current/html/group_10.html,20D20,True
Alexandroff One Point Compactification,"Byliński, Czesław",,http://mizar.org/version/current/html/compact1.html,,False
Arrow's Impossibility Theorem,"Wiedijk, Freek",,http://mizar.org/version/current/html/arrow.html,91B12,True
Congruences and Quotient Algebras  of BCI-algebras,"Ding, Yuzhong and Pang, Zhiyong",,http://mizar.org/version/current/html/bcialg_2.html,06F35,True
Linear Congruence Relation  and Complete Residue Systems,"Liang, Xiquan and Yan, Li and Zhao, Junjie",,http://mizar.org/version/current/html/int_4.html,,False
Several Integrability Formulas  of Special Functions,"Peng, Cuiying and Ge, Fuguo and Liang, Xiquan",,http://mizar.org/version/current/html/integra8.html,,False
Basic Properties of the Rank  of Matrices over a Field,"Pąk, Karol",,http://mizar.org/version/current/html/matrix13.html,15A03,True
Basic Operations on Preordered  Coherent Spaces,"Grue, Klaus E. and Korniłowicz, Artur",,http://mizar.org/version/current/html/pcs_0.html,,False
"Inferior Limit, Superior Limit and Convergence of Sequences of Extended Real Numbers","Yamazaki, Hiroshi and Endou, Noboru and Shidama, Yasunari and Okazaki, Hiroyuki",,http://mizar.org/version/current/html/rinfsup2.html,,False
Several Classes of BCK-algebras  and their Properties,"Sun, Tao and Hu, Dahai and Liang, Xiquan",,http://mizar.org/version/current/html/bcialg_3.html,06F35,True
Several Differentiation Formulas  of Special Functions. Part VI,"Li, Bo and Wang, Pan",,http://mizar.org/version/current/html/fdiff_10.html,,False
The Vector Space of Subsets of a Set Based on Symmetric Difference,"Alama, Jesse",,http://mizar.org/version/current/html/bspace.html,,False
Euler's Polyhedron Formula,"Alama, Jesse",,http://mizar.org/version/current/html/polyform.html,51M20,True
Uniform Boundedness Principle,"Sakurai, Hideki and Kunimune, Hisayoshi and Shidama, Yasunari",,http://mizar.org/version/current/html/lopban_5.html,,False
Gauss Lemma and Law of Quadratic Reciprocity,"Yan, Li and Liang, Xiquan and Zhao, Junjie",,http://mizar.org/version/current/html/int_5.html,,False
Regular Expression Quantifiers – at least m Occurrences,"Trybulec, Michał",,http://mizar.org/version/current/html/flang_3.html,,False
Complete Spaces,"Pąk, Karol",,http://mizar.org/version/current/html/compl_sp.html,,False
Difference and Difference Quotient. Part II,"Li, Bo and Zhuang, Yanping and Liang, Xiquan",,http://mizar.org/version/current/html/diff_2.html,,False
The First Mean Value Theorem for Integrals,"Narita, Keiko and Endou, Noboru and Shidama, Yasunari",,http://mizar.org/version/current/html/mesfunc7.html,26A24,True
Egoroff's Theorem,"Endou, Noboru and Shidama, Yasunari and Narita, Keiko",,http://mizar.org/version/current/html/mesfunc8.html,,False
BCI-algebras with Condition (S)  and their Properties,"Sun, Tao and Zhao, Junjie and Liang, Xiquan",,http://mizar.org/version/current/html/bcialg_4.html,06F35,True
Stability of n-Bit Generalized Full Adder Circuits (GFAs). Part II,"Wasaki, Katsumi",,http://mizar.org/version/current/html/gfacirc2.html,94C11,True
Solutions of Linear Equations,"Pąk, Karol",,http://mizar.org/version/current/html/matrix15.html,15A06,True
Helly Property for Subtrees,"Enright, Jessica and Rudnicki, Piotr",,http://mizar.org/version/current/html/helly.html,05C05,True
Heron's Formula and Ptolemy's Theorem,"Riccardi, Marco",,http://mizar.org/version/current/html/euclid_6.html,51M04,True
Uniqueness of Factoring an Integer and Multiplicative Group ℤ/pℤ^∗,"Okazaki, Hiroyuki and Shidama, Yasunari",,http://mizar.org/version/current/html/int_7.html,,False
Ideals of BCI-algebras and their Properties,"Wu, Chenglong and Ding, Yuzhong",,http://mizar.org/version/current/html/bciideal.html,06F35,True
Banach Algebra of Bounded Functionals,"Shidama, Yasunari and Suzuki, Hikofumi and Endou, Noboru",,http://mizar.org/version/current/html/c0sp1.html,46J10,True
Convex Sets and Convex Combinations  on Complex Linear Spaces,"Matsuzaki, Hidenori and Endou, Noboru and Shidama, Yasunari",,http://mizar.org/version/current/html/convex4.html,,False
"Inner Products, Group, Ring  of Quaternion Numbers","Ge, Fuguo",,http://mizar.org/version/current/html/quatern2.html,11R52,True
Several Higher Differentiation Formulas  of Special Functions,"Zhao, Junjie and Liang, Xiquan and Yan, Li",,http://mizar.org/version/current/html/hfdiff_1.html,,False
Inverse Trigonometric Functions  Arctan and Arccot,"Liang, Xiquan and Xie, Bing",,http://mizar.org/version/current/html/sin_cos9.html,33B10,True
Inverse Trigonometric Functions  Arcsec and Arccosec,"Xie, Bing and Liang, Xiquan and Ge, Fuguo",,http://mizar.org/version/current/html/sincos10.html,33B10,True
The Lebesgue Monotone Convergence Theorem,"Endou, Noboru and Narita, Keiko and Shidama, Yasunari",,http://mizar.org/version/current/html/mesfunc9.html,28A33,True
Mizar Analysis of Algorithms: Algorithms over Integers,"Bancerek, Grzegorz",,http://mizar.org/version/current/html/aofa_i00.html,Exclude-NoDoc,True
Invertibility of Matrices of Field Elements,"Nakamura, Yatsuka and Oniumi, Kunio and Chang, Wenpai",,http://mizar.org/version/current/html/matrix14.html,15A09,True
Ramsey's Theorem,"Riccardi, Marco",,http://mizar.org/version/current/html/ramsey_1.html,05C15,True
Towards the Construction of a Model of Mizar Concepts,"Bancerek, Grzegorz",,http://mizar.org/version/current/html/abcmiz_1.html,Exclude-Util,True
Model Checking. Part II,"Ishida, Kazuhisa",,http://mizar.org/version/current/html/modelc_2.html,68Q60,True
Modular Integer Arithmetic,"Schwarzweller, Christoph",,http://mizar.org/version/current/html/int_6.html,11A07,True
General Theory of Quasi-Commutative BCI-algebras,"Sun, Tao and Pan, Weibo and Wu, Chenglong and Liang, Xiquan",,http://mizar.org/version/current/html/bcialg_5.html,06F35,True
Block Diagonal Matrices,"Pąk, Karol",,http://mizar.org/version/current/html/matrixj1.html,15A20,True
Linear Map of Matrices,"Pąk, Karol",,http://mizar.org/version/current/html/matrlin2.html,15A04,True
Orthomodular Lattices,"Mądra, Elżbieta and Grabowski, Adam",,http://mizar.org/version/current/html/robbins4.html,06B23,True
Basic Properties and Concept  of Selected Subsequence  of Zero Based Finite Sequences,"Nakamura, Yatsuka and Ito, Hisashi",,http://mizar.org/version/current/html/afinsq_2.html,,False
Eigenvalues of a Linear Transformation,"Pąk, Karol",,http://mizar.org/version/current/html/vectsp11.html,,False
Jordan Matrix Decomposition,"Pąk, Karol",,http://mizar.org/version/current/html/matrixj2.html,15A20,True
Fatou's Lemma and the Lebesgue's Convergence Theorem,"Endou, Noboru and Narita, Keiko and Shidama, Yasunari",,http://mizar.org/version/current/html/mesfun10.html,28A33,True
Extended Riemann Integral of Functions  of Real Variable  and One-sided Laplace Transform,"Yamazaki, Masahiko and Yamazaki, Hiroshi and Shidama, Yasunari",,http://mizar.org/version/current/html/integr10.html,26A42,True
Integral of Complex-Valued Measurable Function,"Narita, Keiko and Endou, Noboru and Shidama, Yasunari",,http://mizar.org/version/current/html/mesfun6c.html,28A20,True
Introduction to Matroids,"Bancerek, Grzegorz and Shidama, Yasunari",,http://mizar.org/version/current/html/matroid0.html,05B35,True
Partial Differentiation of Real Binary Functions,"Xie, Bing and Liang, Xiquan and Li, Hongwei",,http://mizar.org/version/current/html/pdiff_2.html,35-XX,True
Model Checking. Part III,"Ishida, Kazuhisa and Shidama, Yasunari",,http://mizar.org/version/current/html/modelc_3.html,68Q60,True
Basic Properties of Circulant Matrices  and Anti-Circular Matrices,"Yue, Xiaopeng and Liang, Xiquan",,http://mizar.org/version/current/html/matrix16.html,15B05,True
On L^1 Space Formed by Real-Valued Partial Functions,"Watase, Yasushige and Endou, Noboru and Shidama, Yasunari",,http://mizar.org/version/current/html/lpspace1.html,46-XX,True
BCI-homomorphisms,"Ding, Yuzhong and Ge, Fuguo and Wu, Chenglong",,http://mizar.org/version/current/html/bcialg_6.html,06F35,True
Stability of the 4-2 Binary Addition Circuit Cells. Part I,"Wasaki, Katsumi",,http://mizar.org/version/current/html/ftacell1.html,94C11,True
Several Differentiation Formulas of Special Functions. Part VII,"Ge, Fuguo and Xie, Bing",,http://mizar.org/version/current/html/fdiff_11.html,,False
Open Mapping Theorem,"Sakurai, Hideki and Kunimune, Hisayoshi and Shidama, Yasunari",,http://mizar.org/version/current/html/lopban_6.html,,False
The Real Vector Spaces of Finite Sequences are Finite Dimensional,"Nakamura, Yatsuka and Korniłowicz, Artur and Oya, Nagato and Shidama, Yasunari",,http://mizar.org/version/current/html/euclid_7.html,51M04,True
"Several Integrability Formulas  of Some Functions,  Orthogonal Polynomials  and Norm Functions","Li, Bo and Zhuang, Yanping and Xie, Bing and Wang, Pan",,http://mizar.org/version/current/html/integra9.html,,False
Several Integrability Formulas of Special Functions. Part II,"Li, Bo and Zhuang, Yanping and Men, Yanhong and Liang, Xiquan",,http://mizar.org/version/current/html/integr11.html,,False
Cell Petri Net Concepts,"Jitsukawa, Mitsuru and Kawamoto, Pauline N. and Shidama, Yasunari and Nakamura, Yatsuka",,http://mizar.org/version/current/html/petri_2.html,93C65,True
Arithmetic Operations on Functions from Sets into Functional Sets,"Korniłowicz, Artur",,http://mizar.org/version/current/html/valued_2.html,,False
Some Operations on Quaternion Numbers,"Li, Bo and Wang, Pan and Liang, Xiquan and Zhuang, Yanping",,http://mizar.org/version/current/html/quatern3.html,11R52,True
Complex Function Differentiability,"Pacharapokin, Chanapat and Yamazaki, Hiroshi and Shidama, Yasunari and Nakamura, Yatsuka",,http://mizar.org/version/current/html/cfdiff_1.html,,False
Kolmogorov's Zero-One Law,"Doll, Agnes",,http://mizar.org/version/current/html/kolmog01.html,60F20,True
Second-Order Partial Differentiation  of Real Binary Functions,"Xie, Bing and Liang, Xiquan and Shen, Xiuzhuan",,http://mizar.org/version/current/html/pdiff_3.html,35-XX,True
The Measurability of Complex-Valued Functional Sequences,"Narita, Keiko and Endou, Noboru and Shidama, Yasunari",,http://mizar.org/version/current/html/mesfun7c.html,,False
Collective Operations on Number-Membered Sets,"Korniłowicz, Artur",,http://mizar.org/version/current/html/member_1.html,,False
Solution of Cubic and Quartic Equations,"Riccardi, Marco",,http://mizar.org/version/current/html/polyeq_5.html,,False
The Perfect Number Theorem  and Wilson's Theorem,"Riccardi, Marco",,http://mizar.org/version/current/html/nat_5.html,11A51,True
Probability on Finite Set and Real-Valued Random Variables,"Okazaki, Hiroyuki and Shidama, Yasunari",,http://mizar.org/version/current/html/random_1.html,,False
Lebesgue's Convergence Theorem  of Complex-Valued Function,"Narita, Keiko and Endou, Noboru and Shidama, Yasunari",,http://mizar.org/version/current/html/mesfun9c.html,28A33,True
The Cauchy-Riemann Differential Equations of Complex Functions,"Yamazaki, Hiroshi and Shidama, Yasunari and Pacharapokin, Chanapat and Nakamura, Yatsuka",,http://mizar.org/version/current/html/cfdiff_2.html,,False
Properties of Primes and Multiplicative Group of a Field,"Arai, Kenichi and Okazaki, Hiroyuki",,http://mizar.org/version/current/html/gr_cy_3.html,,False
Hopf Extension Theorem of Measure,"Endou, Noboru and Okazaki, Hiroyuki and Shidama, Yasunari",,http://mizar.org/version/current/html/measure8.html,,False
Labelled State Transition Systems,"Trybulec, Michał",,http://mizar.org/version/current/html/rewrite3.html,68Q42,True
Probability on Finite and Discrete Set and Uniform Distribution,"Okazaki, Hiroyuki",,http://mizar.org/version/current/html/dist_1.html,60E05,True
Riemann Integral of Functions  from ℝ into ^n,"Miyajima, Keiichi and Shidama, Yasunari",,http://mizar.org/version/current/html/integr15.html,26A42,True
Basic Properties of Even and Odd Functions,"Li, Bo and Men, Yanhong",,http://mizar.org/version/current/html/funct_8.html,,False
Equivalence of Deterministic and Nondeterministic Epsilon Automata,"Trybulec, Michał",,http://mizar.org/version/current/html/fsm_3.html,,False
Basic Properties of Metrizable Topological Spaces,"Pąk, Karol",,http://mizar.org/version/current/html/metrizts.html,,False
Small Inductive Dimension of Topological Spaces,"Pąk, Karol",,http://mizar.org/version/current/html/topdim_1.html,,False
On Rough Subgroup of a Group,"Liang, Xiquan and Li, Dailu",,http://mizar.org/version/current/html/group_11.html,20E07,True
Small Inductive Dimension of Topological Spaces. Part II,"Pąk, Karol",,http://mizar.org/version/current/html/topdim_2.html,,False
Dilworth's Decomposition Theorem for Posets,"Rudnicki, Piotr",,http://mizar.org/version/current/html/dilworth.html,06B35,True
Complex Integral,"Yamazaki, Masahiko and Yamazaki, Hiroshi and Wasaki, Katsumi and Shidama, Yasunari",,http://mizar.org/version/current/html/integr1c.html,,False
On the Lattice of Intervals and Rough Sets,"Grabowski, Adam and Jastrzębska, Magdalena",,http://mizar.org/version/current/html/interva1.html,,False
Basic Properties of Periodic Functions,"Li, Bo and Men, Yanhong and Li, Dailu and Liang, Xiquan",,http://mizar.org/version/current/html/funct_9.html,,False
Epsilon Numbers and Cantor Normal Form,"Bancerek, Grzegorz",,http://mizar.org/version/current/html/ordinal5.html,03E10,True
Vector Functions and their Differentiation Formulas in 3-dimensional Euclidean Spaces,"Liang, Xiquan and Zhao, Piqing and Bai, Ou",,http://mizar.org/version/current/html/euclid_8.html,53A05,True
Banach Algebra of Continuous Functionals and the Space of Real-Valued Continuous Functionals with Bounded Support,"Kanazashi, Katuhiko and Endou, Noboru and Shidama, Yasunari",,http://mizar.org/version/current/html/c0sp2.html,46J10,True
Free Magmas,"Riccardi, Marco",,http://mizar.org/version/current/html/algstr_4.html,08A05,True
Integrability Formulas. Part I,"Li, Bo and Ma, Na",,http://mizar.org/version/current/html/integr12.html,26A42,True
Partial Differentiation of Real Ternary Functions,"Inoué, Takao and Xie, Bing and Liang, Xiquan",,http://mizar.org/version/current/html/pdiff_4.html,35-XX,True
Fixpoint Theorem for Continuous Functions on Chain-Complete Posets,"Ishida, Kazuhisa and Shidama, Yasunari",,http://mizar.org/version/current/html/poset_1.html,06B35,True
Nilpotent Groups,"Li, Dailu and Liang, Xiquan and Men, Yanhong",,http://mizar.org/version/current/html/grnilp_1.html,,False
Difference and Difference Quotient. Part III,"Liang, Xiquan and Tang, Ling",,http://mizar.org/version/current/html/diff_3.html,,False
A Model of Mizar Concepts – Unification,"Bancerek, Grzegorz",,http://mizar.org/version/current/html/abcmiz_a.html,Exclude-Util,True
Representation of the Fibonacci and Lucas Numbers in Terms of Floor and Ceiling,"Jastrzębska, Magdalena",,http://mizar.org/version/current/html/fib_num4.html,,False
The Correspondence Between n-dimensional Euclidean Space and the Product of n Real Lines,"Korniłowicz, Artur",,http://mizar.org/version/current/html/euclid_9.html,,False
Affine Independence in Vector Spaces,"Pąk, Karol",,http://mizar.org/version/current/html/rlaffin1.html,,False
Abstract Simplicial Complexes,"Pąk, Karol",,http://mizar.org/version/current/html/simplex0.html,05C15,True
The Sum and Product of Finite Sequences of Complex Numbers,"Miyajima, Keiichi and Kato, Takahiro",,http://mizar.org/version/current/html/rvsum_2.html,,False
Second-Order Partial Differentiation of Real Ternary Functions,"Inoué, Takao",,http://mizar.org/version/current/html/pdiff_5.html,35-XX,True
Integrability Formulas. Part II,"Li, Bo and Ma, Na and Liang, Xiquan",,http://mizar.org/version/current/html/integr13.html,26A42,True
Integrability Formulas. Part III,"Li, Bo and Ma, Na",,http://mizar.org/version/current/html/integr14.html,26A42,True
On L^p Space Formed by Real-Valued Partial Functions,"Watase, Yasushige and Endou, Noboru and Shidama, Yasunari",,http://mizar.org/version/current/html/lpspace2.html,46-XX,True
Miscellaneous Facts about Open Functions and Continuous Functions,"Korniłowicz, Artur",,http://mizar.org/version/current/html/tops_4.html,,False
On the Continuity of Some Functions,"Korniłowicz, Artur",,http://mizar.org/version/current/html/toprealc.html,,False
The Geometric Interior in Real Linear Spaces,"Pąk, Karol",,http://mizar.org/version/current/html/rlaffin2.html,,False
Sperner's Lemma,"Pąk, Karol",,http://mizar.org/version/current/html/simplex1.html,05C15,True
"Counting Derangements, Non Bijective Functions and the Birthday Problem","Kaliszyk, Cezary",,http://mizar.org/version/current/html/cardfin2.html,05A05,True
Riemann Integral of Functions ℝ into ℂ,"Miyajima, Keiichi and Kato, Takahiro and Shidama, Yasunari",,http://mizar.org/version/current/html/integr16.html,26A42,False
Differentiation of Vector-Valued Functions on n-Dimensional Real Normed Linear Spaces,"Inoué, Takao and Endou, Noboru and Shidama, Yasunari",,http://mizar.org/version/current/html/pdiff_6.html,,False
Probability Measure on Discrete Spaces and Algebra of Real-Valued Random Variables,"Okazaki, Hiroyuki and Shidama, Yasunari",,http://mizar.org/version/current/html/random_2.html,,False
Partial Differentiation of Vector-Valued Functions on n-Dimensional Real Normed Linear Spaces,"Inoué, Takao and Naumowicz, Adam and Endou, Noboru and Shidama, Yasunari",,http://mizar.org/version/current/html/pdiff_7.html,,False
Some Properties of p-Groups and Commutative p-Groups,"Liang, Xiquan and Li, Dailu",,http://mizar.org/version/current/html/groupp_1.html,,False
Riemann Integral of Functions from ℝ into Real Normed Space,"Miyajima, Keiichi and Kato, Takahiro and Shidama, Yasunari",,http://mizar.org/version/current/html/integr18.html,26A42,False
Normal Subgroup of Product of Groups,"Okazaki, Hiroyuki and Arai, Kenichi and Shidama, Yasunari",,http://mizar.org/version/current/html/group_12.html,20D40,True
The Mycielskian of a Graph,"Rudnicki, Piotr and Stewart, Lorna",,http://mizar.org/version/current/html/mycielsk.html,,False
Difference and Difference Quotient. Part IV,"Liang, Xiquan and Tang, Ling and Jiang, Xichun",,http://mizar.org/version/current/html/diff_4.html,,False
The Definition of Topological Manifolds,"Riccardi, Marco",,http://mizar.org/version/current/html/mfold_1.html,57Nxx,True
More on Continuous Functions on Normed Linear Spaces,"Okazaki, Hiroyuki and Endou, Noboru and Shidama, Yasunari",,http://mizar.org/version/current/html/nfcont_3.html,,False
Cartesian Products of Family of Real Linear Spaces,"Okazaki, Hiroyuki and Endou, Noboru and Shidama, Yasunari",,http://mizar.org/version/current/html/prvect_3.html,,False
Formalization of Integral Linear Space,"Futa, Yuichi and Okazaki, Hiroyuki and Shidama, Yasunari",,http://mizar.org/version/current/html/rlvect_x.html,,False
"Partial Differentiation, Differentiation and Continuity on n-Dimensional Real Normed Linear Spaces","Inoué, Takao and Naumowicz, Adam and Endou, Noboru and Shidama, Yasunari",,http://mizar.org/version/current/html/pdiff_8.html,,False
Differentiable Functions into Real Normed Spaces,"Okazaki, Hiroyuki and Endou, Noboru and Narita, Keiko and Shidama, Yasunari",,http://mizar.org/version/current/html/ndiff_3.html,46E15,True
Conway's Games and Some of their Basic Properties,"Nittka, Robin",,http://mizar.org/version/current/html/cgames_1.html,,False
Veblen Hierarchy,"Bancerek, Grzegorz",,http://mizar.org/version/current/html/ordinal6.html,03E10,True
Sorting by Exchanging,"Bancerek, Grzegorz",,http://mizar.org/version/current/html/exchsort.html,,False
Linear Transformations of Euclidean Topological Spaces,"Pąk, Karol",,http://mizar.org/version/current/html/matrtop1.html,,False
Linear Transformations of Euclidean Topological Spaces. Part II,"Pąk, Karol",,http://mizar.org/version/current/html/matrtop2.html,,False
The Axiomatization of Propositional Linear Time Temporal Logic,"Giero, Mariusz",,http://mizar.org/version/current/html/ltlaxio1.html,03B44,True
Banach Algebra of Bounded Complex-Valued Functionals,"Kanazashi, Katuhiko and Okazaki, Hiroyuki and Shidama, Yasunari",,http://mizar.org/version/current/html/cc0sp1.html,46J10,True
Mazur-Ulam Theorem,"Korniłowicz, Artur",,http://mizar.org/version/current/html/mazurulm.html,,False
Set of Points on Elliptic Curve in Projective Coordinates,"Futa, Yuichi and Okazaki, Hiroyuki and Shidama, Yasunari",,http://mizar.org/version/current/html/ec_pf_1.html,,False
Continuity of Barycentric Coordinates in Euclidean Topological Spaces,"Pąk, Karol",,http://mizar.org/version/current/html/rlaffin3.html,,False
Brouwer Fixed Point Theorem for Simplexes,"Pąk, Karol",,http://mizar.org/version/current/html/simplex2.html,54H25,True
Brouwer Fixed Point Theorem in the General Case,"Pąk, Karol",,http://mizar.org/version/current/html/brouwer2.html,54H25,True
Preliminaries to Classical First Order Model Theory,"Caminati, Marco B.",,http://mizar.org/version/current/html/fomodel0.html,03C07,True
"Definition of First Order Language with Arbitrary Alphabet. Syntax of Terms, Atomic Formulas and their Subterms","Caminati, Marco B.",,http://mizar.org/version/current/html/fomodel1.html,03C07,True
First Order Languages: Further Syntax and Semantics,"Caminati, Marco B.",,http://mizar.org/version/current/html/fomodel2.html,03C07,True
"Free Interpretation, Quotient Interpretation and Substitution of a Letter with a Term for First Order Languages","Caminati, Marco B.",,http://mizar.org/version/current/html/fomodel3.html,03C07,True
"Sequent Calculus, Derivability, Provability. Gödel's Completeness Theorem","Caminati, Marco B.",,http://mizar.org/version/current/html/fomodel4.html,03C07,True
Cayley's Theorem,"Korniłowicz, Artur",,http://mizar.org/version/current/html/cayley.html,,False
Borel-Cantelli Lemma,"Jaeger, Peter",,http://mizar.org/version/current/html/bor_cant.html,60F20,True
More on the Continuity of Real Functions,"Narita, Keiko and Korniłowicz, Artur and Shidama, Yasunari",,http://mizar.org/version/current/html/nfcont_4.html,,False
Representation Theorem for Stacks,"Bancerek, Grzegorz",,http://mizar.org/version/current/html/stacks_1.html,,False
Elementary Introduction to Stochastic Finance in Discrete Time,"Jaeger, Peter",,http://mizar.org/version/current/html/finance1.html,62P05,True
Valuation Theory. Part I,"Bancerek, Grzegorz and Kobayashi, Hidetsune and Korniłowicz, Artur",,http://mizar.org/version/current/html/fvaluat1.html,12J20,True
"Functional Space (Ω), (Ω)","Kanazashi, Katuhiko and Okazaki, Hiroyuki and Shidama, Yasunari",,http://mizar.org/version/current/html/cc0sp2.html,,False
The Rotation Group,"Pąk, Karol",,http://mizar.org/version/current/html/matrtop3.html,51F25,True
Differentiable Functions on Normed Linear Spaces,"Shidama, Yasunari",,http://mizar.org/version/current/html/ndiff_5.html,46E15,True
Planes and Spheres as Topological Manifolds. Stereographic Projection,"Riccardi, Marco",,http://mizar.org/version/current/html/mfold_2.html,57Nxx,True
ℤ-modules,"Futa, Yuichi and Okazaki, Hiroyuki and Shidama, Yasunari",,http://mizar.org/version/current/html/zmodul01.html,,False
Morphology for Image Processing. Part I,"Yamazaki, Hiroshi and Byliński, Czesław and Wasaki, Katsumi",,http://mizar.org/version/current/html/morph_01.html,,False
The Differentiable Functions  from ℝ into ^n,"Narita, Keiko and Korniłowicz, Artur and Shidama, Yasunari",,http://mizar.org/version/current/html/ndiff_4.html,46E15,True
Some Basic Properties of Some Special Matrices. Part III,"Liang, Xiquan and Wang, Tao",,http://mizar.org/version/current/html/matrix17.html,15Bxx,True
Riemann Integral of Functions from ℝ into n-dimensional Real Normed Space,"Miyajima, Keiichi and Korniłowicz, Artur and Shidama, Yasunari",,http://mizar.org/version/current/html/integr19.html,46E15,True
