package,authors,description,url,msc,verified
Preliminaries to Structures,Library Committee of the Association of Mizar Users,,http://mizar.org/version/current/html/struct_0.html,Exclude-Util,True
Arithmetic of Non-Negative Rational Numbers,"Bancerek, Grzegorz",,http://mizar.org/version/current/html/arytm_3.html,Exclude-Util,True
Introduction to Arithmetics,"Trybulec, Andrzej",,http://mizar.org/version/current/html/arytm_0.html,Exclude-Util,True
Subsets of Complex Numbers,"Trybulec, Andrzej",,http://mizar.org/version/current/html/numbers.html,Exclude-Util,True
Basic Properties of Real Numbers - Requirements,Library Committee of the Association of Mizar Users,,http://mizar.org/version/current/html/real.html,Exclude-Util,True
Binary Operations on Numbers,Library Committee of the Association of Mizar Users,,http://mizar.org/version/current/html/binop_2.html,08A02,True
Introduction to Arithmetic of Extended Real Numbers,Library Committee of the Association of Mizar Users,,http://mizar.org/version/current/html/xxreal_0.html,Exclude-Util,True
Number-Valued Functions,Library Committee of the Association of Mizar Users,,http://mizar.org/version/current/html/valued_0.html,Exclude-Util,True
Basic Operations on Extended Real Numbers,"Trybulec, Andrzej",,http://mizar.org/version/current/html/xxreal_3.html,Exclude-Util,True
Tarski Grothendieck Set Theory,"Trybulec, Andrzej",,http://fm.mizar.org/1990-1/pdf1-1/tarski.pdf,03E65,True
Built-in Concepts,"Trybulec, Andrzej",,http://fm.mizar.org/1990-1/pdf1-1/axioms.pdf,Exclude-Util,True
Boolean Properties of Sets,"Trybulec, Zinaida and Święczkowska, Halina",,http://fm.mizar.org/1990-1/pdf1-1/boole.pdf,Exclude-Util,True
Enumerated Sets,"Trybulec, Andrzej",,http://fm.mizar.org/1990-1/pdf1-1/enumset1.pdf,Exclude-Util,True
Basic Properties  of Real Numbers,"Hryniewiecki, Krzysztof",,http://fm.mizar.org/1990-1/pdf1-1/real_1.pdf,Exclude-Util,True
The Fundamental Properties of Natural Numbers,"Bancerek, Grzegorz",,http://fm.mizar.org/1990-1/pdf1-1/nat_1.pdf,11A05,True
Some Basic Properties of Sets,"Byliński, Czesław",,http://fm.mizar.org/1990-1/pdf1-1/zfmisc_1.pdf,Exclude-Util,True
Functions and Their Basic Properties,"Byliński, Czesław",,http://fm.mizar.org/1990-1/pdf1-1/funct_1.pdf,03E20,True
Properties of Subsets,"Trybulec, Zinaida",,http://fm.mizar.org/1990-1/pdf1-1/subset_1.pdf,Exclude-Util,True
Relations and Their Basic Properties,"Woronowicz, Edmund",,http://fm.mizar.org/1990-1/pdf1-1/relat_1.pdf,03E20,True
Properties of Binary Relations,"Woronowicz, Edmund and Zalewska, Anna",,http://fm.mizar.org/1990-1/pdf1-1/relat_2.pdf,Exclude-Util,True
The Ordinal Numbers,"Bancerek, Grzegorz",,http://fm.mizar.org/1990-1/pdf1-1/ordinal1.pdf,03E10,True
"Tuples, Projections and Cartesian Products","Trybulec, Andrzej",,http://fm.mizar.org/1990-1/pdf1-1/mcart_1.pdf,Exclude-Util,True
Segments of Natural Numbers and Finite Sequences,"Bancerek, Grzegorz and Hryniewiecki, Krzysztof",,http://fm.mizar.org/1990-1/pdf1-1/finseq_1.pdf,Exclude-Util,True
Domains and Their Cartesian Products,"Trybulec, Andrzej",,http://fm.mizar.org/1990-1/pdf1-1/domain_1.pdf,47A05,True
The Well Ordering Relations,"Bancerek, Grzegorz",,http://fm.mizar.org/1990-1/pdf1-1/wellord1.pdf,06A05,True
A Model of ZF Set Theory Language,"Bancerek, Grzegorz",,http://fm.mizar.org/1990-1/pdf1-1/zf_lang.pdf,03C62,True
Families of Sets,"Padlewska, Beata",,http://fm.mizar.org/1990-1/pdf1-1/setfam_1.pdf,03E20,True
Functions from a Set to a Set,"Byliński, Czesław",,http://fm.mizar.org/1990-1/pdf1-1/funct_2.pdf,03E20,True
Finite Sets,"Darmochwał, Agata",,http://fm.mizar.org/1990-1/pdf1-1/finset_1.pdf,03E20,True
Graphs of Functions,"Byliński, Czesław",,http://fm.mizar.org/1990-1/pdf1-1/grfunc_1.pdf,03E20,True
Binary Operations,"Byliński, Czesław",,http://fm.mizar.org/1990-1/pdf1-1/binop_1.pdf,47A05,True
Relations Defined on Sets,"Woronowicz, Edmund",,http://fm.mizar.org/1990-1/pdf1-1/relset_1.pdf,03E20,True
Boolean Domains,"Trybulec, Andrzej and Darmochwał, Agata",,http://fm.mizar.org/1990-1/pdf1-1/finsub_1.pdf,03E40,True
Models and Satisfiability,"Bancerek, Grzegorz",,http://fm.mizar.org/1990-1/pdf1-1/zf_model.pdf,03E20,True
The Contraction Lemma,"Bancerek, Grzegorz",,http://fm.mizar.org/1990-1/pdf1-1/zf_colla.pdf,03E20,True
Axioms of Incidence,"Trybulec, Wojciech A.",,http://fm.mizar.org/1990-1/pdf1-1/incsp_1.pdf,51A05,True
Introduction to Lattice Theory,"Żukowski, Stanisław",,http://fm.mizar.org/1990-1/pdf1-1/lattices.pdf,03G10,True
Topological Spaces and Continuous Functions,"Padlewska, Beata and Darmochwał, Agata",,http://fm.mizar.org/1990-1/pdf1-1/pre_topc.pdf,26A03,True
Subsets of Topological Spaces,"Wysocki, Mirosław and Darmochwał, Agata",,http://fm.mizar.org/1990-1/pdf1-1/tops_1.pdf,54B05,True
Connected Spaces,"Padlewska, Beata",,http://fm.mizar.org/1990-1/pdf1-1/connsp_1.pdf,54A05,True
Basic Functions and Operations on Functions,"Byliński, Czesław",,http://fm.mizar.org/1990-1/pdf1-1/funct_3.pdf,47A48,True
"Families of Subsets, Subspaces and Mappings in Topological Spaces","Darmochwał, Agata",,http://fm.mizar.org/1990-1/pdf1-2/tops_2.pdf,54C60,True
Some Properties of Functions Modul and Signum,"Popiołek, Jan",,http://fm.mizar.org/1990-1/pdf1-2/anal_1.pdf,Exclude-NoDoc,True
Some Properties of Functions Modul and Signum,"Popiołek, Jan",,http://fm.mizar.org/1990-1/pdf1-2/absvalue.pdf,26A09,True
Zermelo Theorem and Axiom of Choice,"Bancerek, Grzegorz",,http://fm.mizar.org/1990-1/pdf1-2/wellord2.pdf,03E25,True
Real Sequences and Basic Operations on Them,"Kotowicz, Jarosław",,http://fm.mizar.org/1990-1/pdf1-2/seq_1.pdf,40-01 ,True
Convergent Sequences and the Limit of Sequences,"Kotowicz, Jarosław",,http://fm.mizar.org/1990-1/pdf1-2/seq_2.pdf,40A05,True
Properties of ZF Models,"Bancerek, Grzegorz",,http://fm.mizar.org/1990-1/pdf1-2/zfmodel1.pdf,03C62,True
Sequences of Ordinal Numbers,"Bancerek, Grzegorz",,http://fm.mizar.org/1990-1/pdf1-2/ordinal2.pdf,03E10,True
Vectors in Real Linear Space,"Trybulec, Wojciech A.",,http://fm.mizar.org/1990-1/pdf1-2/rlvect_1.pdf,15A03,True
Subspaces and Cosets of Subspaces in Real Linear Space,"Trybulec, Wojciech A.",,http://fm.mizar.org/1990-1/pdf1-2/rlsub_1.pdf,15A03,True
A First Order Language,"Rudnicki, Piotr and Trybulec, Andrzej",,http://fm.mizar.org/1990-1/pdf1-2/qc_lang1.pdf,03B10,True
Partially Ordered Sets,"Trybulec, Wojciech A.",,http://fm.mizar.org/1990-1/pdf1-2/orders_1.pdf,06A06,True
Recursive Definitions,"Hryniewiecki, Krzysztof",,http://fm.mizar.org/1990-1/pdf1-2/recdef_1.pdf,03D20,True
Binary Operations Applied to Functions,"Trybulec, Andrzej",,http://fm.mizar.org/1990-1/pdf1-2/funcop_1.pdf,18F05,True
"Abelian Groups, Fields and Vector Spaces","Kusak, Eugeniusz and Leończuk, Wojciech and Muzalewski, Michał",,http://fm.mizar.org/1990-1/pdf1-2/vectsp_1.pdf,15A03,True
Parallelity Spaces,"Kusak, Eugeniusz and Leończuk, Wojciech and Muzalewski, Michał",,http://fm.mizar.org/1990-1/pdf1-2/parsp_1.pdf,51A15,True
Construction of a bilinear antisymmetric form in simplectic vector space,"Kusak, Eugeniusz and Leończuk, Wojciech and Muzalewski, Michał",,http://fm.mizar.org/1990-1/pdf1-2/symsp_1.pdf,51A50,True
Construction of a bilinear symmetric form in orthogonal vector space,"Kusak, Eugeniusz and Leończuk, Wojciech and Muzalewski, Michał",,http://fm.mizar.org/1990-1/pdf1-2/ortsp_1.pdf,51A50,True
Partial Functions,"Byliński, Czesław",,http://fm.mizar.org/1990-1/pdf1-2/partfun1.pdf,Exclude-Util,True
Semilattice Operations on Finite Subsets,"Trybulec, Andrzej",,http://fm.mizar.org/1990-1/pdf1-2/setwiseo.pdf,03E20,True
Cardinal Numbers,"Bancerek, Grzegorz",,http://fm.mizar.org/1990-1/pdf1-2/card_1.pdf,03E10,True
Compact Spaces,"Darmochwał, Agata",,http://fm.mizar.org/1990-1/pdf1-2/compts_1.pdf,54E45,True
Kuratowski – Zorn Lemma,"Trybulec, Wojciech A. and Bancerek, Grzegorz",,http://fm.mizar.org/1990-1/pdf1-2/orders_2.pdf,03E20,True
Operations on Subspaces in Real Linear Space,"Trybulec, Wojciech A.",,http://fm.mizar.org/1990-1/pdf1-2/rlsub_2.pdf,14N20,True
σ-Fields and Probability,"Nędzusiak, Andrzej",,http://fm.mizar.org/1990-1/pdf1-2/prob_1.pdf,28A05,True
Introduction to Categories and Functors,"Byliński, Czesław",,http://fm.mizar.org/1990-1/pdf1-2/cat_1.pdf,18A05,True
Introduction to Trees,"Bancerek, Grzegorz",,http://fm.mizar.org/1990-1/pdf1-2/trees_1.pdf,05C05,True
Zermelo's Theorem,"Nowak, Bogdan and Białecki, Sławomir",,http://fm.mizar.org/1990-1/pdf1-3/wellset1.pdf,03E20,True
Group and Field Definitions,"Białas, Józef",,http://fm.mizar.org/1990-1/pdf1-3/realset1.pdf,20A05,True
Equivalence Relations and Classes of Abstraction,"Raczkowski, Konrad and Sadowski, Paweł",,http://fm.mizar.org/1990-1/pdf1-3/eqrel_1.pdf,03E02,True
Some Properties of Real Numbers,"Trybulec, Andrzej and Byliński, Czesław",,http://fm.mizar.org/1990-1/pdf1-3/square_1.pdf,Exclude-Util,True
Connectives and Subformulae of the First Order Language,"Bancerek, Grzegorz",,http://fm.mizar.org/1990-1/pdf1-3/qc_lang2.pdf,03B10,True
Variables in Formulae of the First Order Language,"Byliński, Czesław and Bancerek, Grzegorz",,http://fm.mizar.org/1990-1/pdf1-3/qc_lang3.pdf,03B10,True
Monotone Real Sequences. Subsequences,"Kotowicz, Jarosław",,http://fm.mizar.org/1990-1/pdf1-3/seqm_3.pdf,26A48,True
Convergent Real Sequences. Upper and Lower Bound of Sets of Real Numbers,"Kotowicz, Jarosław",,http://fm.mizar.org/1990-1/pdf1-3/seq_4.pdf,40A05,True
Midpoint algebras,"Muzalewski, Michał",,http://fm.mizar.org/1990-1/pdf1-3/midsp_1.pdf,15A03,True
The Fundamental Logic Structure in Quantum Mechanics,"Sadowski, Paweł and Trybulec, Andrzej and Raczkowski, Konrad",,http://fm.mizar.org/1990-1/pdf1-3/qmax_1.pdf,81P10,True
Function Domains and Frænkel Operator,"Trybulec, Andrzej",,http://fm.mizar.org/1990-1/pdf1-3/fraenkel.pdf,03E47,True
Integers,"Trybulec, Michał J.",,http://fm.mizar.org/1990-1/pdf1-3/int_1.pdf,Exclude-Util,True
The Complex Numbers,"Byliński, Czesław",,http://fm.mizar.org/1990-1/pdf1-3/complex1.pdf,Exclude-Util,True
Ordinal Arithmetics,"Bancerek, Grzegorz",,http://fm.mizar.org/1990-1/pdf1-3/ordinal3.pdf,03E10,True
The Modification of a Function by a Function and the Iteration of the Composition of a Function,"Byliński, Czesław",,http://fm.mizar.org/1990-1/pdf1-3/funct_4.pdf,,False
Finite Sequences and Tuples of Elements of a Non-empty Sets,"Byliński, Czesław",,http://fm.mizar.org/1990-1/pdf1-3/finseq_2.pdf,Exclude-Util,True
Curried and Uncurried Functions,"Bancerek, Grzegorz",,http://fm.mizar.org/1990-1/pdf1-3/funct_5.pdf,18A99,True
Cardinal Arithmetics,"Bancerek, Grzegorz",,http://fm.mizar.org/1990-1/pdf1-3/card_2.pdf,03E10,True
Fano-Desargues Parallelity Spaces,"Kusak, Eugeniusz and Leończuk, Wojciech",,http://fm.mizar.org/1990-1/pdf1-3/parsp_2.pdf,51A15,True
Real Functions Spaces,"Oryszczyszyn , Henryk and Prażmowski, Krzysztof",,http://fm.mizar.org/1990-1/pdf1-3/funcsdom.pdf,13J30,True
Tarski's Classes and Ranks,"Bancerek, Grzegorz",,http://fm.mizar.org/1990-1/pdf1-3/classes1.pdf,03E20,True
Non-contiguous Substrings and One-to-one Finite Sequences,"Trybulec, Wojciech A.",,http://fm.mizar.org/1990-1/pdf1-3/finseq_3.pdf,Exclude-Util,True
Pigeon Hole Principle,"Trybulec, Wojciech A.",,http://fm.mizar.org/1990-1/pdf1-3/finseq_4.pdf,Exclude-Util,True
Linear Combinations in Real Linear Space,"Trybulec, Wojciech A.",,http://fm.mizar.org/1990-1/pdf1-3/rlvect_2.pdf,15A04,True
König's Theorem,"Bancerek, Grzegorz",,http://fm.mizar.org/1990-1/pdf1-3/card_3.pdf,03E10,True
Universal Classes,"Nowak, Bogdan and Bancerek, Grzegorz",,http://fm.mizar.org/1990-1/pdf1-3/classes2.pdf,03E20,True
Analytical Ordered Affine Spaces,"Oryszczyszyn, Henryk and Prażmowski, Krzysztof",,http://fm.mizar.org/1990-1/pdf1-3/analoaf.pdf,51N10,True
Metric Spaces,"Kanas, Stanisława and Lecko, Adam and Startek, Mariusz",,http://fm.mizar.org/1990-1/pdf1-3/metric_1.pdf,54E35,True
Ordered Affine Spaces Defined in Terms of Directed Parallelity – Part I,"Oryszczyszyn, Henryk and Prażmowski, Krzysztof",,http://fm.mizar.org/1990-1/pdf1-3/diraf.pdf,51N10,True
Parallelity and Lines in Affine Spaces,"Oryszczyszyn, Henryk and Prażmowski, Krzysztof",,http://fm.mizar.org/1990-1/pdf1-3/aff_1.pdf,14R10,True
Classical Configurations in Affine Planes,"Oryszczyszyn, Henryk and Prażmowski, Krzysztof",,http://fm.mizar.org/1990-1/pdf1-4/aff_2.pdf,14R10,True
Affine Localizations of Desargues Axiom,"Kusak, Eugeniusz and Oryszczyszyn, Henryk and Prażmowski, Krzysztof",,http://fm.mizar.org/1990-1/pdf1-4/aff_3.pdf,14R10,True
Binary Operations Applied to Finite Sequences,"Byliński, Czesław",,http://fm.mizar.org/1990-1/pdf1-4/finseqop.pdf,40B99,True
Semigroup operations on finite subsets,"Byliński, Czesław",,http://fm.mizar.org/1990-1/pdf1-4/setwop_2.pdf,03E20,True
The Collinearity Structure,"Skaba, Wojciech",,http://fm.mizar.org/1990-1/pdf1-4/collsp.pdf,51A05,True
The Sum and Product of Finite Sequences of Real Numbers,"Byliński, Czesław",,http://fm.mizar.org/1990-1/pdf1-4/rvsum_1.pdf,Exclude-Util,True
A Classical First Order Language,"Byliński, Czesław",,http://fm.mizar.org/1990-1/pdf1-4/cqc_lang.pdf,03B10,True
Classical and Non–classical Pasch Configurations in Ordered Affine Planes,"Oryszczyszyn, Henryk and Prażmowski, Krzysztof and Prażmowska, Małgorzata",,http://fm.mizar.org/1990-1/pdf1-4/pasch.pdf,51M05,True
The Lattice of Real Numbers. The Lattice of Real Functions,"Chmur, Marek",,http://fm.mizar.org/1990-1/pdf1-4/real_lat.pdf,03G10,True
A Construction of an Abstract Space of Congruence of Vectors,"Lewandowski, Grzegorz and Prażmowski, Krzysztof",,http://fm.mizar.org/1990-1/pdf1-4/tdgroup.pdf,20Kxx,True
A First–Order Predicate Calculus,"Darmochwał, Agata",,http://fm.mizar.org/1990-1/pdf1-4/cqc_the1.pdf,03B10,True
Partial Functions from a Domain to a Domain,"Kotowicz, Jarosław",,http://fm.mizar.org/1990-1/pdf1-4/partfun2.pdf,03E20,True
Partial Functions from a Domain to the Set of Real Numbers,"Kotowicz, Jarosław",,http://fm.mizar.org/1990-1/pdf1-4/rfunct_1.pdf,03E20,True
Increasing and Continuous Ordinal Sequences,"Bancerek, Grzegorz",,http://fm.mizar.org/1990-1/pdf1-4/ordinal4.pdf,03E10,True
Transformations in Affine Spaces,"Oryszczyszyn, Henryk and Prażmowski, Krzysztof",,http://fm.mizar.org/1990-1/pdf1-4/transgeo.pdf,51N10,True
Subcategories and Products of Categories,"Byliński, Czesław",,http://fm.mizar.org/1990-1/pdf1-4/cat_2.pdf,18A05,True
Many Argument Relations,"Woronowicz, Edmund",,http://fm.mizar.org/1990-1/pdf1-4/margrel1.pdf,08A02,True
Interpretation and Satisfiability in the First Order Logic,"Woronowicz, Edmund",,http://fm.mizar.org/1990-1/pdf1-4/valuat_1.pdf,03B10,True
Probability,"Nędzusiak, Andrzej",,http://fm.mizar.org/1990-1/pdf1-4/prob_2.pdf,60A05,True
Translations in Affine Planes,"Oryszczyszyn, Henryk and Prażmowski, Krzysztof",,http://fm.mizar.org/1990-1/pdf1-4/translac.pdf,,False
Introduction to Probability,"Popiołek, Jan",,http://fm.mizar.org/1990-1/pdf1-4/rpr_1.pdf,60A05,True
A Construction of Analytical Projective Space,"Leończuk, Wojciech and Prażmowski, Krzysztof",,http://fm.mizar.org/1990-1/pdf1-4/anproj_1.pdf,51N05,True
Projective Spaces – Part I,"Leończuk, Wojciech and Prażmowski, Krzysztof",,http://fm.mizar.org/1990-1/pdf1-4/anproj_2.pdf,51N15,True
Topological Properties of Subsets in Real Numbers,"Raczkowski, Konrad and Sadowski, Paweł",,http://fm.mizar.org/1990-1/pdf1-4/rcomp_1.pdf,54C30,True
Properties of Real Functions,"Kotowicz, Jarosław",,http://fm.mizar.org/1990-1/pdf1-4/rfunct_2.pdf,26A48,True
Real Function Continuity,"Raczkowski, Konrad and Sadowski, Paweł",,http://fm.mizar.org/1990-1/pdf1-4/fcont_1.pdf,26A15,True
Real Function Uniform Continuity,"Kotowicz, Jarosław and Raczkowski, Konrad",,http://fm.mizar.org/1990-1/pdf1-4/fcont_2.pdf,26A15,True
Real Function Differentiability,"Raczkowski, Konrad and Sadowski, Paweł",,http://fm.mizar.org/1990-1/pdf1-4/fdiff_1.pdf,26A27,True
Average Value Theorems for Real Functions of One Variable,"Kotowicz, Jarosław and Raczkowski, Konrad and Sadowski, Paweł",,http://fm.mizar.org/1990-1/pdf1-4/rolle.pdf,26A24,True
Properties of Fields,"Białas, Józef",,http://fm.mizar.org/1990-1/pdf1-5/realset2.pdf,,False
Filters – Part I,"Bancerek, Grzegorz",,http://fm.mizar.org/1990-1/pdf1-5/filter_0.pdf,54A20,True
Groups,"Trybulec, Wojciech A.",,http://fm.mizar.org/1990-1/pdf1-5/group_1.pdf,20A05,True
The Divisibility of Integers and Integer Relatively Primes,"Kwiatek, Rafał and Zwara, Grzegorz",,http://fm.mizar.org/1990-1/pdf1-5/int_2.pdf,11A51,True
From Loops to Abelian Multiplicative Groups with Zero,"Muzalewski, Michał and Skaba, Wojciech",,http://fm.mizar.org/1990-1/pdf1-5/algstr_1.pdf,,False
Basic Properties of Rational Numbers,"Kondracki, Andrzej",,http://fm.mizar.org/1990-1/pdf1-5/rat_1.pdf,11B05,True
Basis of Real Linear Space,"Trybulec, Wojciech A.",,http://fm.mizar.org/1990-1/pdf1-5/rlvect_3.pdf,15A03,True
Finite Sums of Vectors in Vector Space,"Trybulec, Wojciech A.",,http://fm.mizar.org/1990-1/pdf1-5/vectsp_3.pdf,15A03,True
Subgroup and Cosets of Subgroups,"Trybulec, Wojciech A.",,http://fm.mizar.org/1990-1/pdf1-5/group_2.pdf,20E07,True
Subspaces and Cosets of Subspaces in Vector Space,"Trybulec, Wojciech A.",,http://fm.mizar.org/1990-1/pdf1-5/vectsp_4.pdf,54B05,True
Operations on Subspaces in Vector Space,"Trybulec, Wojciech A.",,http://fm.mizar.org/1990-1/pdf1-5/vectsp_5.pdf,54B05,True
Linear Combinations in Vector Space,"Trybulec, Wojciech A.",,http://fm.mizar.org/1990-1/pdf1-5/vectsp_6.pdf,15A04,True
Basis of Vector Space,"Trybulec, Wojciech A.",,http://fm.mizar.org/1990-1/pdf1-5/vectsp_7.pdf,15A03,True
Factorial and Newton coefficients,"Kwiatek, Rafał",,http://fm.mizar.org/1990-1/pdf1-5/newton.pdf,05A10,True
Analytical Metric Affine Spaces and Planes,"Oryszczyszyn, Henryk and Prażmowski, Krzysztof",,http://fm.mizar.org/1990-1/pdf1-5/analmetr.pdf,51N10,True
Projective Spaces – part II,"Leończuk, Wojciech and Prażmowski, Krzysztof",,http://fm.mizar.org/1990-1/pdf1-5/anproj_3.pdf,51N15,True
Projective Spaces – part III,"Leończuk, Wojciech and Prażmowski, Krzysztof",,http://fm.mizar.org/1990-1/pdf1-5/anproj_4.pdf,51N15,True
Projective Spaces – part IV,"Leończuk, Wojciech and Prażmowski, Krzysztof",,http://fm.mizar.org/1990-1/pdf1-5/anproj_5.pdf,51N15,True
Projective Spaces – part V,"Leończuk, Wojciech and Prażmowski, Krzysztof",,http://fm.mizar.org/1990-1/pdf1-5/anproj_6.pdf,51N15,True
Projective Spaces – part VI,"Leończuk, Wojciech and Prażmowski, Krzysztof",,http://fm.mizar.org/1990-1/pdf1-5/anproj_7.pdf,51N15,True
Some Elementary Notions of the Theory of Petri Nets,"Korczyński, Waldemar",,http://fm.mizar.org/1990-1/pdf1-5/net_1.pdf,93C65,True
Classes of Conjugation. Normal Subgroups,"Trybulec, Wojciech A.",,http://fm.mizar.org/1990-1/pdf1-5/group_3.pdf,20A05,True
Replacing of Variables in Formulas of ZF Theory,"Bancerek, Grzegorz",,http://fm.mizar.org/1990-1/pdf1-5/zf_lang1.pdf,03E30,True
The Reflection Theorem,"Bancerek, Grzegorz",,http://fm.mizar.org/1990-1/pdf1-5/zf_refle.pdf,,False
Binary Operations on Finite Sequences,"Trybulec, Wojciech A.",,http://fm.mizar.org/1990-1/pdf1-5/finsop_1.pdf,,False
Finite Join and Finite Meet and Dual Lattices,"Trybulec, Andrzej",,http://fm.mizar.org/1990-1/pdf1-5/lattice2.pdf,06D20,True
Consequences of the Reflection Theorem,"Bancerek, Grzegorz",,http://fm.mizar.org/1990-1/pdf1-5/zfrefle1.pdf,,False
"Construction of Rings and Left-, Right-, and Bi-Modules over a Ring","Muzalewski, Michał",,http://fm.mizar.org/1991-2/pdf2-1/vectsp_2.pdf,16D20,True
Desargues Theorem In Projective 3-Space,"Kusak, Eugeniusz",,http://fm.mizar.org/1991-2/pdf2-1/projdes1.pdf,51A05,True
The Limit of a Real Function at Infinity,"Kotowicz, Jarosław",,http://fm.mizar.org/1991-2/pdf2-1/limfunc1.pdf,26A03,True
One-Side Limits of a Real Function at a Point,"Kotowicz, Jarosław",,http://fm.mizar.org/1991-2/pdf2-1/limfunc2.pdf,26A03,True
Lattice of Subgroups of a Group. Frattini Subgroup,"Trybulec, Wojciech A.",,http://fm.mizar.org/1991-2/pdf2-1/group_4.pdf,20D25,True
Equalities and Inequalities in Real Numbers,"Kondracki, Andrzej",,http://fm.mizar.org/1991-2/pdf2-1/real_2.pdf,Exclude-Util,True
Countable Sets and Hessenberg's Theorem,"Bancerek, Grzegorz",,http://fm.mizar.org/1991-2/pdf2-1/card_4.pdf,51A30,True
The Limit of a Real Function at a Point,"Kotowicz, Jarosław",,http://fm.mizar.org/1991-2/pdf2-1/limfunc3.pdf,26A03,True
The Limit of a Composition of Real Functions,"Kotowicz, Jarosław",,http://fm.mizar.org/1991-2/pdf2-1/limfunc4.pdf,26A03,True
Locally Connected Spaces,"Padlewska, Beata",,http://fm.mizar.org/1991-2/pdf2-1/connsp_2.pdf,54D05,True
"Construction of Finite Sequences over Ring and Left-, Right-,  and Bi-Modules over a Ring","Muzalewski, Michał and Szczerba, Lesław W.",,http://fm.mizar.org/1991-2/pdf2-1/algseq_1.pdf,13C05,True
Relations of Tolerance,"Hryniewiecki, Krzysztof",,http://fm.mizar.org/1991-2/pdf2-1/toler_1.pdf,08A02,True
Real Normed Space,"Popiołek, Jan",,http://fm.mizar.org/1991-2/pdf2-1/normsp_1.pdf,46Bxx,True
Schemes of Existence of some Types of Functions,"Kotowicz, Jarosław",,http://fm.mizar.org/1991-2/pdf2-1/scheme1.pdf,14A15,True
Integer and Rational Exponents,"Raczkowski, Konrad",,http://fm.mizar.org/1991-2/pdf2-1/prepower.pdf,26A09,True
Homotheties and Shears in Affine Planes,"Oryszczyszyn, Henryk and Prażmowski, Krzysztof",,http://fm.mizar.org/1991-2/pdf2-1/homothet.pdf,51N10,True
Directed Geometrical Bundles and Their Analytical Representation,"Lewandowski, Grzegorz and Prażmowski, Krzysztof and Lewandowska, Bożena",,http://fm.mizar.org/1991-2/pdf2-1/afvect0.pdf,32L10,True
Definable Functions,"Bancerek, Grzegorz",,http://fm.mizar.org/1991-2/pdf2-1/zfmodel2.pdf,03E30,True
Propositional Calculus,"Bancerek, Grzegorz  and Darmochwał, Agata and Trybulec, Andrzej",,http://fm.mizar.org/1991-2/pdf2-1/lukasi_1.pdf,03B05,True
Complex Spaces,"Byliński, Czesław and Trybulec, Andrzej",,http://fm.mizar.org/1991-2/pdf2-1/complsp1.pdf,32C15,True
Several Properties of Fields. Field Theory,"Białas, Józef",,http://fm.mizar.org/1991-2/pdf2-1/realset3.pdf,12E30,True
Infimum and Supremum of the Set of Real Numbers. Measure Theory,"Białas, Józef",,http://fm.mizar.org/1991-2/pdf2-1/supinf_1.pdf,06B20,True
Series of  Positive Real Numbers. Measure Theory,"Białas, Józef",,http://fm.mizar.org/1991-2/pdf2-1/supinf_2.pdf,28A10,True
From Double Loops to Fields,"Skaba, Wojciech and Muzalewski, Michał",,http://fm.mizar.org/1991-2/pdf2-1/algstr_2.pdf,12E15,True
Metrics in Cartesian Product,"Kanas, Stanisława and Stankiewicz, Jan",,http://fm.mizar.org/1991-2/pdf2-2/metric_3.pdf,54E35,True
Submetric Spaces – Part I,"Lecko, Adam and Startek, Mariusz",,http://fm.mizar.org/1991-2/pdf2-2/sub_metr.pdf,54E35,True
On Pseudometric Spaces,"Lecko, Adam and Startek, Mariusz",,http://fm.mizar.org/1991-2/pdf2-2/metric_2.pdf,54E25,True
Real Exponents and Logarithms,"Raczkowski, Konrad and Nędzusiak, Andrzej",,http://fm.mizar.org/1991-2/pdf2-2/power.pdf,26A09,True
Hessenberg Theorem,"Kusak, Eugeniusz and Leończuk, Wojciech",,http://fm.mizar.org/1991-2/pdf2-2/hessenbe.pdf,51A30,False
Three-Argument Operations and Four-Argument Operations,"Muzalewski, Michał and Skaba, Wojciech",,http://fm.mizar.org/1991-2/pdf2-2/multop_1.pdf,,False
Incidence Projective Spaces,"Leończuk, Wojciech and Prażmowski, Krzysztof",,http://fm.mizar.org/1991-2/pdf2-2/incproj.pdf,51A05,True
"One-Dimensional Congruence of Segments, Basic Facts and Midpoint  Relation","Konstanta, Barbara and Kowieska, Urszula and Lewandowski, Grzegorz and Prażmowski, Krzysztof",,http://fm.mizar.org/1991-2/pdf2-2/afvect01.pdf,,False
Algebra of Normal Forms,"Trybulec, Andrzej",,http://fm.mizar.org/1991-2/pdf2-2/normform.pdf,,False
Ordered Rings – Part I,"Muzalewski, Michał and Szczerba, Lesław W.",,http://fm.mizar.org/1991-2/pdf2-2/o_ring_1.pdf,06F25,True
Ordered Rings – Part II,"Muzalewski, Michał and Szczerba, Lesław W.",,http://fm.mizar.org/1991-2/pdf2-2/o_ring_2.pdf,06F25,True
Ordered Rings – Part III,"Muzalewski, Michał and Szczerba, Lesław W.",,http://fm.mizar.org/1991-2/pdf2-2/o_ring_3.pdf,06F25,True
N-Tuples and Cartesian Products for n=5,"Muzalewski, Michał and Skaba, Wojciech",,http://fm.mizar.org/1991-2/pdf2-2/mcart_2.pdf,,False
Ternary Fields,"Muzalewski, Michał and Skaba, Wojciech",,http://fm.mizar.org/1991-2/pdf2-2/algstr_3.pdf,20N10,True
The σ-additive Measure Theory,"Białas, Józef",,http://fm.mizar.org/1991-2/pdf2-2/measure1.pdf,28A05,True
Incidence Projective Space (a reduction theorem in a plane),"Kusak, Eugeniusz and Leończuk, Wojciech",,http://fm.mizar.org/1991-2/pdf2-2/projred1.pdf,51A05,True
"Groups, Rings, Left- and Right-Modules","Muzalewski, Michał and Skaba, Wojciech",,http://fm.mizar.org/1991-2/pdf2-2/mod_1.pdf,16D20,True
Finite Sums of Vectors in Left Module over Associative Ring,"Muzalewski, Michał and Skaba, Wojciech",,http://fm.mizar.org/1991-2/pdf2-2/lmod_1.pdf,13C05,True
Submodules and Cosets of Submodules in Left Module over Associative Ring,"Muzalewski, Michał and Skaba, Wojciech",,http://fm.mizar.org/1991-2/pdf2-2/lmod_2.pdf,13C05,True
Operations on Submodules in Left Module over Associative Ring,"Muzalewski, Michał and Skaba, Wojciech",,http://fm.mizar.org/1991-2/pdf2-2/lmod_3.pdf,13C05,True
Linear Combinations in Left Module over Associative Ring,"Muzalewski, Michał and Skaba, Wojciech",,http://fm.mizar.org/1991-2/pdf2-2/lmod_4.pdf,13C05,True
Linear Independence in Left Module over Domain,"Muzalewski, Michał and Skaba, Wojciech",,http://fm.mizar.org/1991-2/pdf2-2/lmod_5.pdf,13C05,True
Calculus of Propositions,"Popiołek, Jan and Trybulec, Andrzej",,http://fm.mizar.org/1991-2/pdf2-2/procal_1.pdf,03B05,True
