package,authors,description,url,msc,verified
"Convex Hull, Set of Convex Combinations and Convex Cone","Endou, Noboru and Shidama, Yasunari",,http://fm.mizar.org/2003-11/pdf11-3/convex3.pdf,,False
On the Two Short Axiomatizations of Ortholattices,"Truszkowska, Wioletta and Grabowski, Adam",,http://fm.mizar.org/2003-11/pdf11-3/robbins2.pdf,06B23,True
On the Sets Inhabited by Numbers,"Trybulec, Andrzej",,http://fm.mizar.org/2003-11/pdf11-4/membered.pdf,,False
Definition of Convex Function  and Jensen's Inequality,"Ivanov, Grigory E.",,http://fm.mizar.org/2003-11/pdf11-4/convfun1.pdf,,False
On Semilattice Structure of Mizar Types,"Bancerek, Grzegorz",,http://fm.mizar.org/2003-11/pdf11-4/abcmiz_0.pdf,,False
Lines in n-Dimensional Euclidean Spaces,"Kubo, Akihiro",,http://fm.mizar.org/2003-11/pdf11-4/euclid_4.pdf,51M04,True
Banach Space of Absolute Summable  Real Sequences,"Suzuki, Yasumasa and Endou, Noboru and Shidama, Yasunari",,http://fm.mizar.org/2003-11/pdf11-4/rsspace3.pdf,,False
Cross Products and Tripple Vector Products  in 3-dimensional Euclidean Space,"Kanchun and Yamazaki, Hiroshi and Nakamura, Yatsuka",,http://fm.mizar.org/2003-11/pdf11-4/euclid_5.pdf,51M04,True
Calculation of Matrices of Field Elements. Part I,"Nakamura, Yatsuka and Yamazaki, Hiroshi",,http://fm.mizar.org/2003-11/pdf11-4/matrix_4.pdf,15Axx,True
Lattice of Fuzzy Sets,"Mitsuishi, Takashi and Bancerek, Grzegorz",,http://fm.mizar.org/2003-11/pdf11-4/lfuzzy_0.pdf,03E72,True
On the Kuratowski Limit Operators,"Grabowski, Adam",,http://fm.mizar.org/2003-11/pdf11-4/kurato_2.pdf,,False
On the Segmentation of a Simple Closed Curve,"Trybulec, Andrzej",,http://fm.mizar.org/2003-11/pdf11-4/jordan_a.pdf,57K20,True
On the Calculus of Binary Arithmetics,"Kobayashi, Shunichi",,http://fm.mizar.org/2003-11/pdf11-4/binari_5.pdf,,False
SCMPDS Is Not Standard,"Korniłowicz, Artur and Shidama, Yasunari",,http://fm.mizar.org/2003-11/pdf11-4/scmpds_9.pdf,,False
On the Upper and Lower Approximations of the Curve,"Milewski, Robert",,http://fm.mizar.org/2003-11/pdf11-4/jordan19.pdf,57K20,True
Sorting Operators for Finite Sequences,"Nakamura, Yatsuka",,http://fm.mizar.org/2004-12/pdf12-1/rfinseq2.pdf,,False
Magnitude Relation Properties of Radix-2^k SD Number,"Niimura, Masaaki and Fuwa, Yasushi",,http://fm.mizar.org/2004-12/pdf12-1/radix_5.pdf,,False
High Speed Modulo Calculation Algorithm with Radix-2^k SD Number,"Niimura, Masaaki and Fuwa, Yasushi",,http://fm.mizar.org/2004-12/pdf12-1/radix_6.pdf,,False
Transitive Closure of Fuzzy Relations,"Mitsuishi, Takashi and Bancerek, Grzegorz",,http://fm.mizar.org/2004-12/pdf12-1/lfuzzy_1.pdf,03E72,True
Basic Properties of Rough Sets and Rough Membership Function,"Grabowski, Adam",,http://fm.mizar.org/2004-12/pdf12-1/roughs_1.pdf,03E72,True
Correctness of Non Overwriting Programs. Part I,"Nakamura, Yatsuka",,http://fm.mizar.org/2004-12/pdf12-1/prgcor_1.pdf,,False
A Tree of Execution of a Macroinstruction,"Korniłowicz, Artur",,http://fm.mizar.org/2004-12/pdf12-1/amistd_3.pdf,,False
Banach Space of Bounded Linear Operators,"Shidama, Yasunari",,http://fm.mizar.org/2004-12/pdf12-1/lopban_1.pdf,,False
Little Bezout Theorem (Factor Theorem),"Rudnicki, Piotr",,http://fm.mizar.org/2004-12/pdf12-1/uproots.pdf,,False
Primitive Roots of Unity and Cyclotomic Polynomials,"Arneson, Broderick and Rudnicki, Piotr",,http://fm.mizar.org/2004-12/pdf12-1/uniroots.pdf,,False
Witt's Proof of the Wedderburn Theorem,"Arneson, Broderick and Baaz, Matthias and Rudnicki, Piotr",,http://fm.mizar.org/2004-12/pdf12-1/weddwitt.pdf,,False
Banach Space of Bounded Real Sequences,"Suzuki, Yasumasa",,http://fm.mizar.org/2004-12/pdf12-2/rsspace4.pdf,,False
Solving Roots of Polynomial Equation  of Degree 2 and 3 with Complex Coefficients,"Ding, Yuzhong and Liang, Xiquan",,http://fm.mizar.org/2004-12/pdf12-2/polyeq_3.pdf,,False
Complex Linear Space and Complex Normed Space,"Endou, Noboru",,http://fm.mizar.org/2004-12/pdf12-2/clvect_1.pdf,,False
The Banach Algebra of Bounded Linear Operators,"Shidama, Yasunari",,http://fm.mizar.org/2004-12/pdf12-2/lopban_2.pdf,,False
Complex Linear Space of Complex Sequences,"Endou, Noboru",,http://fm.mizar.org/2004-12/pdf12-2/csspace.pdf,,False
Behaviour of an Arc Crossing a Line,"Nakamura, Yatsuka",,http://fm.mizar.org/2004-12/pdf12-2/jordan20.pdf,57K20,True
Some Set Series  in Finite Topological Spaces.  Fundamental Concepts for Image Processing,"Tanaka, Masami and Nakamura, Yatsuka",,http://fm.mizar.org/2004-12/pdf12-2/fintopo3.pdf,,False
The Series on Banach Algebra,"Shidama, Yasunari",,http://fm.mizar.org/2004-12/pdf12-2/lopban_3.pdf,,False
Formulas and Identities of Trigonometric Functions,"Pacharapokin, Chanapat and Kanchun and Yamazaki, Hiroshi",,http://fm.mizar.org/2004-12/pdf12-2/sin_cos4.pdf,33B10,True
The Class of Series-Parallel Graphs.  Part III,"Retel, Krzysztof",,http://fm.mizar.org/2004-12/pdf12-2/neckla_3.pdf,,False
Relocability for SCM over Ring,"Korniłowicz, Artur and Shidama, Yasunari",,http://fm.mizar.org/2004-12/pdf12-2/scmring4.pdf,,False
Convergent Sequences in Complex Unitary Space,"Endou, Noboru",,http://fm.mizar.org/2004-12/pdf12-2/clvect_2.pdf,,False
Recursive Definitions. Part II,"Korniłowicz, Artur",,http://fm.mizar.org/2004-12/pdf12-2/recdef_2.pdf,03D20,True
The Exponential Function on Banach Algebra,"Shidama, Yasunari",,http://fm.mizar.org/2004-12/pdf12-2/lopban_4.pdf,32A65,True
Fundamental Theorem of Arithmetic,"Korniłowicz, Artur and Rudnicki, Piotr",,http://fm.mizar.org/2004-12/pdf12-2/nat_3.pdf,,False
Hilbert Space of Complex Sequences,"Endou, Noboru",,http://fm.mizar.org/2004-12/pdf12-2/csspace2.pdf,,False
Banach Space of Absolute Summable Complex Sequences,"Endou, Noboru",,http://fm.mizar.org/2004-12/pdf12-2/csspace3.pdf,32A65,True
The Taylor Expansions,"Shidama, Yasunari",,http://fm.mizar.org/2004-12/pdf12-2/taylor_1.pdf,,False
Complex Banach Space of Bounded Linear Operators,"Endou, Noboru",,http://fm.mizar.org/2004-12/pdf12-2/clopban1.pdf,32A65,True
Complex Banach Space of Bounded Complex Sequences,"Endou, Noboru",,http://fm.mizar.org/2004-12/pdf12-2/csspace4.pdf,32A65,True
Concatenation of Finite Sequences Reducing Overlapping Part and an Argument  of Separators of Sequential Files,"Fukura, Hirofumi and Nakamura, Yatsuka",,http://fm.mizar.org/2004-12/pdf12-2/finseq_8.pdf,,False
Cauchy Sequence of Complex Unitary Space,"Suzuki, Yasumasa and Endou, Noboru",,http://fm.mizar.org/2004-12/pdf12-2/clvect_3.pdf,,False
Complex Valued Functions Space,"Endou, Noboru",,http://fm.mizar.org/2004-12/pdf12-3/cfuncdom.pdf,,False
Banach Algebra of Bounded Complex Linear Operators,"Endou, Noboru",,http://fm.mizar.org/2004-12/pdf12-3/clopban2.pdf,32A65,True
Formulas and Identities of Trigonometric Functions,"Ding, Yuzhong and Liang, Xiquan",,http://fm.mizar.org/2004-12/pdf12-3/sin_cos5.pdf,33B10,True
Solving Roots of the Special Polynomial Equation with Real Coefficients,"Ding, Yuzhong and Liang, Xiquan",,http://fm.mizar.org/2004-12/pdf12-3/polyeq_4.pdf,,False
Algebraic Properties of Homotopies,"Grabowski, Adam and Korniłowicz, Artur",,http://fm.mizar.org/2004-12/pdf12-3/borsuk_6.pdf,,False
The Fundamental Group,"Korniłowicz, Artur and Shidama, Yasunari and Grabowski, Adam",,http://fm.mizar.org/2004-12/pdf12-3/topalg_1.pdf,,False
The Continuous Functions on Normed Linear Spaces,"Nishiyama, Takaya and Ohkubo, Keiji and Shidama, Yasunari",,http://fm.mizar.org/2004-12/pdf12-3/nfcont_1.pdf,,False
The Uniform Continuity of Functions on Normed Linear Spaces,"Nishiyama, Takaya and Korniłowicz, Artur and Shidama, Yasunari",,http://fm.mizar.org/2004-12/pdf12-3/nfcont_2.pdf,,False
Series on Complex Banach Algebra,"Endou, Noboru",,http://fm.mizar.org/2004-12/pdf12-3/clopban3.pdf,32A65,True
Exponential Function on Complex Banach Algebra,"Endou, Noboru",,http://fm.mizar.org/2004-12/pdf12-3/clopban4.pdf,32A65,True
The Fundamental Group of Convex Subspaces of ^n_,"Korniłowicz, Artur",,http://fm.mizar.org/2004-12/pdf12-3/topalg_2.pdf,,False
Intersections of Intervals and Balls in ^n_,"Korniłowicz, Artur and Shidama, Yasunari",,http://fm.mizar.org/2004-12/pdf12-3/topreal9.pdf,,False
Some Properties of Fibonacci Numbers,"Jastrzȩbska, Magdalena and Grabowski, Adam",,http://fm.mizar.org/2004-12/pdf12-3/fib_num2.pdf,,False
The Hall Marriage Theorem,"Romanowicz, Ewa and Grabowski, Adam",,http://fm.mizar.org/2004-12/pdf12-3/hallmar1.pdf,,False
The Differentiable Functions on Normed Linear Spaces,"Imura, Hiroshi and Kimura, Morishige and Shidama, Yasunari",,http://fm.mizar.org/2004-12/pdf12-3/ndiff_1.pdf,,False
Lucas Numbers and Generalized Fibonacci Numbers,"Wojtecki, Piotr and Grabowski, Adam",,http://fm.mizar.org/2004-12/pdf12-3/fib_num3.pdf,,False
The Operation of Addition of Relational Structures,"Romanowicz, Katarzyna and Grabowski, Adam",,http://fm.mizar.org/2004-12/pdf12-3/latsum_1.pdf,,False
The Nagata-Smirnov Theorem. Part I,"Pąk, Karol",,http://fm.mizar.org/2004-12/pdf12-3/nagata_1.pdf,,False
Properties of Groups,"Geleijnse, Gijs and Bancerek, Grzegorz",,http://fm.mizar.org/2004-12/pdf12-3/group_8.pdf,20A05,True
Catalan Numbers,"Częstochowska, Dorota and Grabowski, Adam",,http://fm.mizar.org/2004-12/pdf12-3/catalan1.pdf,,False
Axiomatization of Boolean Algebras Based on Sheffer Stroke,"Kozarkiewicz, Violetta and Grabowski, Adam",,http://fm.mizar.org/2004-12/pdf12-3/sheffer1.pdf,,False
Short Sheffer Stroke-Based Single Axiom for Boolean Algebras,"Łukaszuk, Aneta and Grabowski, Adam",,http://fm.mizar.org/2004-12/pdf12-3/sheffer2.pdf,,False
Differentiable Functions on Normed Linear Spaces. Part II,"Imura, Hiroshi and Sakai, Yuji and Shidama, Yasunari",,http://fm.mizar.org/2004-12/pdf12-3/ndiff_2.pdf,,False
Logical Correctness of Vector Calculation Programs,"Nishiyama, Takaya and Fukura, Hirofumi and Nakamura, Yatsuka",,http://fm.mizar.org/2004-12/pdf12-3/prgcor_2.pdf,,False
Continuous Mappings between Finite and One-Dimensional Finite Topological Spaces,"Imura, Hiroshi and Tanaka, Masami and Nakamura, Yatsuka",,http://fm.mizar.org/2004-12/pdf12-3/fintopo4.pdf,,False
The Nagata-Smirnov Theorem. Part II,"Pąk, Karol",,http://fm.mizar.org/2004-12/pdf12-3/nagata_2.pdf,,False
On the Isomorphism of Fundamental Groups,"Korniłowicz, Artur",,http://fm.mizar.org/2004-12/pdf12-3/topalg_3.pdf,,False
Algebra of Complex Vector Valued Functions,"Endou, Noboru",,http://fm.mizar.org/2004-12/pdf12-3/vfunct_2.pdf,,False
Continuous Functions on Real and Complex Normed Linear Spaces,"Endou, Noboru",,http://fm.mizar.org/2004-12/pdf12-3/ncfcont1.pdf,,False
On the Fundamental Groups of Products of Topological Spaces,"Korniłowicz, Artur",,http://fm.mizar.org/2004-12/pdf12-3/topalg_4.pdf,,False
Partial Sum of Some Series,"Liang, Ming and Ding, Yuzhong",,http://fm.mizar.org/2005-13/pdf13-1/series_2.pdf,40A25,True
Substitution in First-Order Formulas: Elementary Properties,"Braselmann, Patrick and Koepke, Peter",,http://fm.mizar.org/2005-13/pdf13-1/substut1.pdf,,False
Coincidence Lemma and Substitution Lemma,"Braselmann, Patrick and Koepke, Peter",,http://fm.mizar.org/2005-13/pdf13-1/sublemma.pdf,,False
"Substitution in First-Order Formulas.  Part II.
The Construction of First-Order Formulas","Braselmann, Patrick and Koepke, Peter",,http://fm.mizar.org/2005-13/pdf13-1/substut2.pdf,03C35,True
A Sequent Calculus for First-Order Logic,"Braselmann, Patrick and Koepke, Peter",,http://fm.mizar.org/2005-13/pdf13-1/calcul_1.pdf,,False
Consequences of the Sequent Calculus,"Braselmann, Patrick and Koepke, Peter",,http://fm.mizar.org/2005-13/pdf13-1/calcul_2.pdf,,False
Equivalences of Inconsistency and Henkin Models,"Braselmann, Patrick and Koepke, Peter",,http://fm.mizar.org/2005-13/pdf13-1/henmodel.pdf,,False
Gödel's Completeness Theorem,"Braselmann, Patrick and Koepke, Peter",,http://fm.mizar.org/2005-13/pdf13-1/goedelcp.pdf,03C35,True
"Propositional Calculus for Boolean Valued Functions.
Part VIII","Kobayashi, Shunichi",,http://fm.mizar.org/2005-13/pdf13-1/bvfunc26.pdf,03B05,True
Hölder's Inequality and Minkowski's Inequality,"Suzuki, Yasumasa",,http://fm.mizar.org/2005-13/pdf13-1/holder_1.pdf,,False
The Banach Space l^p,"Suzuki, Yasumasa",,http://fm.mizar.org/2005-13/pdf13-1/lp_space.pdf,,False
Lebesgue Integral of Simple Valued Function,"Shidama, Yasunari and Endou, Noboru",,http://fm.mizar.org/2005-13/pdf13-1/mesfunc3.pdf,26A42,True
Inverse Trigonometric Functions Arcsin and Arccos,"Korniłowicz, Artur and Shidama, Yasunari",,http://fm.mizar.org/2005-13/pdf13-1/sin_cos6.pdf,33B10,True
On Some Points of a Simple Closed Curve,"Korniłowicz, Artur",,http://fm.mizar.org/2005-13/pdf13-1/jordan21.pdf,57K20,True
On Some Points of a Simple Closed Curve. Part II,"Korniłowicz, Artur and Grabowski, Adam",,http://fm.mizar.org/2005-13/pdf13-1/jordan22.pdf,57K20,True
Uniform Continuity of Functions on Normed Complex Linear Spaces,"Endou, Noboru",,http://fm.mizar.org/2005-13/pdf13-1/ncfcont2.pdf,,False
Introduction to Real Linear Topological Spaces,"Byliński, Czesław",,http://fm.mizar.org/2005-13/pdf13-1/rltopsp1.pdf,46E10,True
Some Properties of Rectangles on the Plane,"Korniłowicz, Artur and Shidama, Yasunari",,http://fm.mizar.org/2005-13/pdf13-1/topreala.pdf,51N20,True
Some Properties of Circles on the Plane,"Korniłowicz, Artur and Shidama, Yasunari",,http://fm.mizar.org/2005-13/pdf13-1/toprealb.pdf,51N20,True
"On the Characterization of Collineations of the
Segre Product of Strongly Connected Partial Linear Spaces","Naumowicz, Adam",,http://fm.mizar.org/2005-13/pdf13-1/pencil_3.pdf,,False
"Spaces of Pencils, Grassmann Spaces, and Generalized Veronese Spaces","Naumowicz, Adam",,http://fm.mizar.org/2005-13/pdf13-1/pencil_4.pdf,,False
On the Boundary and Derivative of a Set,"Grabowski, Adam",,http://fm.mizar.org/2005-13/pdf13-1/topgen_1.pdf,,False
"Construction of Gröbner Bases:
Avoiding S-Polynomials – Buchberger's First Criterium","Schwarzweller, Christoph",,http://fm.mizar.org/2005-13/pdf13-1/groeb_3.pdf,13P10,True
A Theory of Matrices of Complex Elements,"Chang, Wenpai and Yamazaki, Hiroshi and Nakamura, Yatsuka",,http://fm.mizar.org/2005-13/pdf13-1/matrix_5.pdf,15B33,True
On the Characteristic and Weight of a Topological Space,"Bancerek, Grzegorz",,http://fm.mizar.org/2005-13/pdf13-1/topgen_2.pdf,,False
On Constructing Topological Spaces and Sorgenfrey Line,"Bancerek, Grzegorz",,http://fm.mizar.org/2005-13/pdf13-1/topgen_3.pdf,,False
On the Real Valued Functions,"Korniłowicz, Artur",,http://fm.mizar.org/2005-13/pdf13-1/partfun3.pdf,,False
Formalization of Ortholattices via Orthoposets,"Grabowski, Adam and Moschner, Markus",,http://fm.mizar.org/2005-13/pdf13-1/robbins3.pdf,06C15,True
The Fashoda Meet Theorem for Rectangles,"Nakamura, Yatsuka and Trybulec, Andrzej",,http://fm.mizar.org/2005-13/pdf13-2/jgraph_7.pdf,57K20,True
Preliminaries to Mathematical Morphology and Its Properties,"Ding, Yuzhong and Liang, Xiquan",,http://fm.mizar.org/2005-13/pdf13-2/mathmorp.pdf,,False
"Subsequences of Almost, Weakly and Poorly One-to-one Finite Sequences","Milewski, Robert",,http://fm.mizar.org/2005-13/pdf13-2/jordan23.pdf,57K20,True
Alternative Graph Structures,"Lee, Gilbert and Rudnicki, Piotr",,http://fm.mizar.org/2005-13/pdf13-2/glib_000.pdf,05Cxx,True
Walks in Graphs,"Lee, Gilbert",,http://fm.mizar.org/2005-13/pdf13-2/glib_001.pdf,05C38,True
Trees and Graph Components,"Lee, Gilbert",,http://fm.mizar.org/2005-13/pdf13-2/glib_002.pdf,05C05,True
Weighted and Labeled Graphs,"Lee, Gilbert",,http://fm.mizar.org/2005-13/pdf13-2/glib_003.pdf,05C22,True
Correctness of Dijkstra's Shortest Path and Prim's Minimum Spanning Tree Algorithms,"Lee, Gilbert and Rudnicki, Piotr",,http://fm.mizar.org/2005-13/pdf13-2/glib_004.pdf,05C38,True
Correctnesss of Ford-Fulkerson's Maximum Flow Algorithm,"Lee, Gilbert",,http://fm.mizar.org/2005-13/pdf13-2/glib_005.pdf,05C21,True
Properties of Connected Subsets  of the Real Line,"Korniłowicz, Artur",,http://fm.mizar.org/2005-13/pdf13-2/rcomp_3.pdf,,False
The Fundamental Group of the Circle,"Korniłowicz, Artur",,http://fm.mizar.org/2005-13/pdf13-2/topalg_5.pdf,,False
Brouwer Fixed Point Theorem for Disks on the Plane,"Korniłowicz, Artur and Shidama, Yasunari",,http://fm.mizar.org/2005-13/pdf13-2/brouwer.pdf,54H25,True
Stirling Numbers of the Second Kind,"Pąk, Karol",,http://fm.mizar.org/2005-13/pdf13-2/stirl2_1.pdf,11B73,True
Limit of Sequence of Subsets,"Zhang, Bo and Yamazaki, Hiroshi and Nakamura, Yatsuka",,http://fm.mizar.org/2005-13/pdf13-2/setlim_1.pdf,,False
"The Properties of Supercondensed Sets, Subcondensed Sets and Condensed Sets","Jastrzȩbska, Magdalena and Grabowski, Adam",,http://fm.mizar.org/2005-13/pdf13-2/isomichi.pdf,,False
Properties of First and Second Order Cutting of Binary Relations,"Retel, Krzysztof",,http://fm.mizar.org/2005-13/pdf13-3/relset_2.pdf,,False
The Inner Product and Conjugate of Finite Sequences of Complex Numbers,"Chang, Wenpai and Yamazaki, Hiroshi and Nakamura, Yatsuka",,http://fm.mizar.org/2005-13/pdf13-3/complsp2.pdf,,False
Inferior Limit and Superior Limit of Sequences of Real Numbers,"Zhang, Bo and Yamazaki, Hiroshi and Nakamura, Yatsuka",,http://fm.mizar.org/2005-13/pdf13-3/rinfsup1.pdf,,False
Formulas and Identities of Inverse Hyperbolic Functions,"Ge, Fuguo and Liang, Xiquan and Ding, Yuzhong",,http://fm.mizar.org/2005-13/pdf13-3/sin_cos7.pdf,33B10,True
Lines on Planes in n-Dimensional Euclidean Spaces,"Kubo, Akihiro",,http://fm.mizar.org/2005-13/pdf13-3/euclidlp.pdf,,False
Cardinal Numbers and Finite Sets,"Pąk, Karol",,http://fm.mizar.org/2005-13/pdf13-3/card_fin.pdf,,False
Some Equations Related to the Limit  of Sequence of Subsets,"Zhang, Bo and Yamazaki, Hiroshi and Nakamura, Yatsuka",,http://fm.mizar.org/2005-13/pdf13-3/setlim_2.pdf,,False
On the Partial Product of Series and Related Basic Inequalities,"Ge, Fuguo and Liang, Xiquan",,http://fm.mizar.org/2005-13/pdf13-3/series_3.pdf,,False
"Homeomorphism between Finite Topological Spaces, Two-Dimensional Lattice Spaces and a Fixed Point Theorem","Tanaka, Masami and Imura, Hiroshi and Nakamura, Yatsuka",,http://fm.mizar.org/2005-13/pdf13-3/fintopo5.pdf,,False
The Maclaurin Expansions,"Nishino, Akira and Shidama, Yasunari",,http://fm.mizar.org/2005-13/pdf13-3/taylor_2.pdf,,False
Several Differentiable Formulas of Special Functions,"Zhang, Yan and Liang, Xiquan",,http://fm.mizar.org/2005-13/pdf13-3/fdiff_4.pdf,,False
Set Sequences and Monotone Class,"Zhang, Bo and Yamazaki, Hiroshi and Nakamura, Yatsuka",,http://fm.mizar.org/2005-13/pdf13-4/prob_3.pdf,,False
A Theory of Sequential Files,"Fukura, Hirofumi and Nakamura, Yatsuka",,http://fm.mizar.org/2005-13/pdf13-4/filerec1.pdf,,False
"Circled Sets, Circled Hull, and Circled Family","Zhai, Fahui and Cao, Jianbing and Liang, Xiquan",,http://fm.mizar.org/2005-13/pdf13-4/circled1.pdf,,False
On the Borel Families of Subsets of Topological Spaces,"Grabowski, Adam",,http://fm.mizar.org/2005-13/pdf13-4/topgen_4.pdf,,False
Linearity of Lebesgue Integral of Simple Valued Function,"Endou, Noboru and Shidama, Yasunari",,http://fm.mizar.org/2005-13/pdf13-4/mesfunc4.pdf,26A42,True
The Fashoda Meet Theorem for Continuous Mappings,"Nakamura, Yatsuka and Trybulec, Andrzej and Korniłowicz, Artur",,http://fm.mizar.org/2005-13/pdf13-4/jgraph_8.pdf,57K20,True
Tietze Extension Theorem,"Korniłowicz, Artur and Bancerek, Grzegorz and Naumowicz, Adam",,http://fm.mizar.org/2005-13/pdf13-4/tietze.pdf,,False
Homeomorphisms of Jordan Curves,"Naumowicz, Adam and Bancerek, Grzegorz",,http://fm.mizar.org/2005-13/pdf13-4/jordan24.pdf,57K20,True
Jordan Curve Theorem,"Korniłowicz, Artur",,http://fm.mizar.org/2005-13/pdf13-4/jordan.pdf,57K20,True
The Inner Product and Conjugate of Matrix of Complex Numbers,"Chang, Wenpai and Yamazaki, Hiroshi and Nakamura, Yatsuka",,http://fm.mizar.org/2005-13/pdf13-4/matrixc1.pdf,15A63,True
Partial Sum and Partial Product of Some Series,"Cao, Jianbing and Zhai, Fahui and Liang, Xiquan",,http://fm.mizar.org/2005-13/pdf13-4/series_4.pdf,,False
Some Differentiable Formulas of Special Functions,"Cao, Jianbing and Zhai, Fahui and Liang, Xiquan",,http://fm.mizar.org/2005-13/pdf13-4/fdiff_5.pdf,,False
Formulas and Identities of Hyperbolic Functions,"Pacharapokin, Chanapat and Yamazaki, Hiroshi",,http://fm.mizar.org/2005-13/pdf13-4/sin_cos8.pdf,33B10,True
Niemytzki Plane - an Example of Tychonoff Space Which Is Not T_4,"Bancerek, Grzegorz",,http://fm.mizar.org/2005-13/pdf13-4/topgen_5.pdf,,False
On the Partial Product and Partial Sum of Series and Related Basic Inequalities,"Ge, Fuguo and Liang, Xiquan",,http://fm.mizar.org/2005-13/pdf13-4/series_5.pdf,,False
Several Differentiable Formulas of Special Functions. Part II,"Zhang, Yan and Li, Bo and Liang, Xiquan",,http://fm.mizar.org/2005-13/pdf13-4/fdiff_6.pdf,,False
On the Calculus of Binary Arithmetics. Part II,"Kobayashi, Shunichi",,http://fm.mizar.org/2005-13/pdf13-4/binari_6.pdf,,False
Some Properties of Some Special Matrices,"Yue, Xiaopeng and Liang, Xiquan and Sun, Zhongpin",,http://fm.mizar.org/2005-13/pdf13-4/matrix_6.pdf,15B10,True
Generalized Full Adder Circuits (GFAs). Part I,"Yamaguchi, Shin'nosuke and Wasaki, Katsumi and Shimoi, Nobuhiro",,http://fm.mizar.org/2005-13/pdf13-4/gfacirc1.pdf,94C11,True
Quotient Rings,"Korniłowicz, Artur",,http://fm.mizar.org/2005-13/pdf13-4/ring_1.pdf,13A15,True
Completeness of the Real Euclidean Space,"Endou, Noboru and Shidama, Yasunari",,http://fm.mizar.org/2005-13/pdf13-4/real_ns1.pdf,,False
Determinant of Some Matrices  of Field Elements,"Nakamura, Yatsuka",,http://mizar.org/version/current/html/matrix_7.html,15A15,True
Some Properties of Some Special Matrices.  Part II,"Yue, Xiaopeng and Hu, Dahai and Liang, Xiquan",,http://mizar.org/version/current/html/matrix_8.html,15Bxx,True
On the Permanent of a Matrix,"Romanowicz, Ewa and Grabowski, Adam",,http://mizar.org/version/current/html/matrix_9.html,15A15,True
A Theory of Matrices of Real Elements,"Nakamura, Yatsuka and Tamura, Nobuyuki and Chang, Wenpai",,http://mizar.org/version/current/html/matrixr1.html,15Axx,True
On the Properties of the Möbius Function,"Jastrzȩbska, Magdalena and Grabowski, Adam",,http://mizar.org/version/current/html/moebius1.html,,False
Several Differentiation Formulas  of Special Functions. Part III,"Li, Bo and Zhang, Yan and Liang, Xiquan",,http://mizar.org/version/current/html/fdiff_7.html,,False
Pocklington's Theorem and Bertrand's Postulate,"Riccardi, Marco",,http://mizar.org/version/current/html/nat_4.html,,False
Integral of Measurable Function,"Endou, Noboru and Shidama, Yasunari",,http://mizar.org/version/current/html/mesfunc5.html,28A20,True
Simple Continued Fractions  and Their Convergents,"Li, Bo and Zhang, Yan and Korniłowicz, Artur",,http://mizar.org/version/current/html/real_3.html,,False
Chordal Graphs,"Arneson, Broderick and Rudnicki, Piotr",,http://mizar.org/version/current/html/chord.html,05C99,True
Connectedness and Continuous Sequences  in Finite Topological Spaces,"Nakamura, Yatsuka",,http://mizar.org/version/current/html/fintopo6.html,54D05,True
"The Definition of Finite Sequences  and Matrices of Probability, and Addition of Matrices of Real Elements","Zhang, Bo and Nakamura, Yatsuka",,http://mizar.org/version/current/html/matrprob.html,,False
Several Differentiation Formulas  of Special Functions. Part IV,"Li, Bo and Wang, Peng",,http://mizar.org/version/current/html/fdiff_8.html,,False
Difference and Difference Quotient,"Li, Bo and Zhang, Yan and Liang, Xiquan",,http://mizar.org/version/current/html/diff_1.html,,False
Multiplication of Polynomials  using Discrete Fourier Transformation,"Treyderowski, Krzysztof and Schwarzweller, Christoph",,http://mizar.org/version/current/html/polynom8.html,,False
Some Special Matrices of Real Elements  and Their Properties,"Liang, Xiquan and Ge, Fuguo and Yue, Xiaopeng",,http://mizar.org/version/current/html/matrix10.html,15Bxx,True
Schur's Theorem on the Stability of Networks,"Schwarzweller, Christoph and Rowińska-Schwarzweller, Agnieszka",,http://mizar.org/version/current/html/hurwitz.html,,False
Integral of Real-Valued  Measurable Function,"Shidama, Yasunari and Endou, Noboru",,http://mizar.org/version/current/html/mesfunc6.html,28A20,True
The Catalan Numbers. Part II,"Pąk, Karol",,http://mizar.org/version/current/html/catalan2.html,,False
The Quaternion Numbers,"Liang, Xiquan and Ge, Fuguo",,http://mizar.org/version/current/html/quaterni.html,11R52,True
Model Checking. Part I,"Ishida, Kazuhisa",,http://mizar.org/version/current/html/modelc_1.html,68Q60,True
Recognizing Chordal Graphs: Lex BFS and MCS,"Arneson, Broderick and Rudnicki, Piotr",,http://mizar.org/version/current/html/lexbfs.html,05C99,True
Integrability and the Integral  of Partial Functions from ℝ into ℝ,"Endou, Noboru and Shidama, Yasunari and Yamazaki, Masahiko",,http://mizar.org/version/current/html/integra6.html,26A27,True
Baire's Category Theorem and Some Spaces  Generated from Real Normed Space,"Endou, Noboru and Shidama, Yasunari and Okamura, Katsumasa",,http://mizar.org/version/current/html/normsp_2.html,46Bxx,True
On the Representation of Natural Numbers  in Positional Numeral Systems,"Naumowicz, Adam",,http://mizar.org/version/current/html/numeral1.html,11A07,True
"The Relevance of Measure and Probability, and Definition of Completeness of Probability","Zhang, Bo and Yamazaki, Hiroshi and Nakamura, Yatsuka",,http://mizar.org/version/current/html/prob_4.html,,False
Several Classes of BCI-algebras  and their Properties,"Ding, Yuzhong",,http://mizar.org/version/current/html/bcialg_1.html,06F35,True
Formal Languages – Concatenation and Closure,"Trybulec, Michał",,http://mizar.org/version/current/html/flang_1.html,,False
Basic Properties of Determinants  of Square Matrices over a Field,"Pąk, Karol",,http://mizar.org/version/current/html/matrix11.html,15A15,True
